[
  {
    "id": "accessibility",
    "path": "accessibility",
    "category": "security",
    "name": "Accessibility Expert",
    "description": "Expert assistant for web accessibility (WCAG 2.1/2.2), inclusive UX, and a11y testing",
    "risk": "low",
    "source": "project",
    "date_added": "2026-06-20"
  },
  {
    "id": "accessibility-runtime-tester",
    "path": "accessibility-runtime-tester",
    "category": "testing",
    "name": "Accessibility Runtime Tester",
    "description": "Runtime accessibility specialist for keyboard flows, focus management, dialog behavior, form errors, and evidence-backed WCAG validation in the browser.",
    "risk": "low",
    "source": "project",
    "date_added": "2026-06-20"
  },
  {
    "id": "acquire-codebase-knowledge",
    "path": "acquire-codebase-knowledge",
    "category": "documentation",
    "name": "acquire-codebase-knowledge",
    "description": "Use this skill when the user explicitly asks to map, document, or onboard into an existing codebase. Trigger for prompts like \"map this codebase\", \"document this architecture\", \"onboard me to this repo\", or \"create codebase docs\". Do not trigger for routine feature implementation, bug fixes, or narrow code edits unless the user asks for repository-level discovery.",
    "risk": "low",
    "source": "project",
    "date_added": "2026-06-20"
  },
  {
    "id": "adr-generator",
    "path": "adr-generator",
    "category": "architecture",
    "name": "ADR Generator",
    "description": "Expert agent for creating comprehensive Architectural Decision Records (ADRs) with structured formatting optimized for AI consumption and human readability.",
    "risk": "low",
    "source": "project",
    "date_added": "2026-06-20"
  },
  {
    "id": "api-architect",
    "path": "api-architect",
    "category": "testing",
    "name": "API Architect",
    "description": "Your role is that of an API architect. Help mentor the engineer by providing guidance, support, and working code.",
    "risk": "low",
    "source": "project",
    "date_added": "2026-06-20"
  },
  {
    "id": "build",
    "path": "build",
    "category": "research",
    "name": "build",
    "description": "build",
    "risk": "unknown",
    "source": "community",
    "date_added": "2026-06-12"
  },
  {
    "id": "create-agentsmd",
    "path": "create-agentsmd",
    "category": "testing",
    "name": "create-agentsmd",
    "description": "Prompt for generating an AGENTS.md file for a repository",
    "risk": "low",
    "source": "project",
    "date_added": "2026-06-20"
  },
  {
    "id": "create-voltagent",
    "path": "create-voltagent",
    "category": "documentation",
    "name": "create-voltagent",
    "description": "Skill for creating AI agent projects using the VoltAgent framework. Guide for CLI setup and manual bootstrapping.",
    "risk": "low",
    "source": "project",
    "date_added": "2026-06-20"
  },
  {
    "id": "dependabot",
    "path": "dependabot",
    "category": "backend",
    "name": "dependabot",
    "description": "Comprehensive guide for configuring and managing GitHub Dependabot. Use this skill when users ask about creating or optimizing dependabot.yml files, managing Dependabot pull requests, configuring dependency update strategies, setting up grouped updates, monorepo patterns, multi-ecosystem groups, security update configuration, auto-triage rules, or any GitHub Advanced Security (GHAS) supply chain security topic related to Dependabot. For pre-commit dependency vulnerability scanning in AI coding agents via the GitHub MCP Server, this skill references the Advanced Security plugin (`advanced-security@copilot-plugins`). Use this skill when an agent needs to scan dependencies for known vulnerabilities before committing.",
    "risk": "low",
    "source": "project",
    "date_added": "2026-06-20"
  },
  {
    "id": "devops-expert",
    "path": "devops-expert",
    "category": "devops",
    "name": "DevOps Expert",
    "description": "DevOps specialist following the infinity loop principle (Plan → Code → Build → Test → Release → Deploy → Operate → Monitor) with focus on automation, collaboration, and continuous improvement",
    "risk": "low",
    "source": "project",
    "date_added": "2026-06-20"
  },
  {
    "id": "doublecheck",
    "path": "doublecheck",
    "category": "research",
    "name": "doublecheck",
    "description": "Three-layer verification pipeline for AI output. Extracts verifiable claims, finds supporting or contradicting sources via web search, runs adversarial review for hallucination patterns, and produces a structured verification report with source links for human review.",
    "risk": "low",
    "source": "project",
    "date_added": "2026-06-20"
  },
  {
    "id": "gem-devops",
    "path": "gem-devops",
    "category": "devops",
    "name": "gem-devops",
    "description": "Infrastructure deployment, CI/CD pipelines, container management.",
    "risk": "low",
    "source": "project",
    "date_added": "2026-06-20"
  },
  {
    "id": "gem-documentation-writer",
    "path": "gem-documentation-writer",
    "category": "documentation",
    "name": "gem-documentation-writer",
    "description": "Technical documentation, README files, API docs, diagrams, walkthroughs.",
    "risk": "low",
    "source": "project",
    "date_added": "2026-06-20"
  },
  {
    "id": "gem-reviewer",
    "path": "gem-reviewer",
    "category": "frontend",
    "name": "gem-reviewer",
    "description": "Security auditing, code review, OWASP scanning, PRD compliance verification.",
    "risk": "low",
    "source": "project",
    "date_added": "2026-06-20"
  },
  {
    "id": "github-actions-efficiency",
    "path": "github-actions-efficiency",
    "category": "devops",
    "name": "github-actions-efficiency",
    "description": "Audit GitHub Actions workflow efficiency and recommend fixes to reduce CI minutes and costs.",
    "risk": "low",
    "source": "project",
    "date_added": "2026-06-20"
  },
  {
    "id": "github-actions-expert",
    "path": "github-actions-expert",
    "category": "security",
    "name": "GitHub Actions Expert",
    "description": "GitHub Actions specialist focused on secure CI/CD workflows, action pinning, OIDC authentication, permissions least privilege, and supply-chain security",
    "risk": "low",
    "source": "project",
    "date_added": "2026-06-20"
  },
  {
    "id": "mcp-security-audit",
    "path": "mcp-security-audit",
    "category": "backend",
    "name": "mcp-security-audit",
    "description": "Audit MCP (Model Context Protocol) server configurations for security issues. Use this skill when:\n- Reviewing .mcp.json files for security risks\n- Checking MCP server args for hardcoded secrets or shell injection patterns\n- Validating that MCP servers use pinned versions (not @latest)\n- Detecting unpinned dependencies in MCP server configurations\n- Auditing which MCP servers a project registers and whether they're on an approved list\n- Checking for environment variable usage vs. hardcoded credentials in MCP configs\n- Any request like \"is my MCP config secure?\", \"audit my MCP servers\", or \"check .mcp.json\"\nkeywords: [mcp, security, audit, secrets, shell-injection, supply-chain, governance]",
    "risk": "low",
    "source": "project",
    "date_added": "2026-06-20"
  },
  {
    "id": "memory-merger",
    "path": "memory-merger",
    "category": "devops",
    "name": "memory-merger",
    "description": "Merges mature lessons from a domain memory file into its instruction file. Syntax: `/memory-merger >domain [scope]` where scope is `global` (default), `user`, `workspace`, or `ws`.",
    "risk": "low",
    "source": "project",
    "date_added": "2026-06-20"
  },
  {
    "id": "modme-generative-ui-migrate",
    "path": "modme-generative-ui-migrate",
    "category": "frontend",
    "name": "modme-generative-ui-migrate",
    "description": "Framework migration playbook for moving GenerativeUI (CopilotKit + agent-server) into next-forge without breaking the legacy stack. Use when porting web-dashboard, GenerativeCanvas, shared-schemas, or planning Phase 4 migration.",
    "risk": "low",
    "source": "project",
    "date_added": "2026-06-20"
  },
  {
    "id": "multi-stage-dockerfile",
    "path": "multi-stage-dockerfile",
    "category": "performance",
    "name": "multi-stage-dockerfile",
    "description": "Create optimized multi-stage Dockerfiles for any language or framework",
    "risk": "low",
    "source": "project",
    "date_added": "2026-06-20"
  },
  {
    "id": "next-forge",
    "path": "next-forge",
    "category": "backend-database",
    "name": "next-forge",
    "description": "Expert assistance for next-forge — a production-grade Turborepo template for Next.js SaaS apps. Triggers on questions about next-forge installation, setup, architecture, packages, customization, deployment, and development workflows.",
    "risk": "low",
    "source": "project",
    "date_added": "2026-06-20"
  },
  {
    "id": "playwright-automation-fill-in-form",
    "path": "playwright-automation-fill-in-form",
    "category": "testing",
    "name": "playwright-automation-fill-in-form",
    "description": "Automate filling in a form using Playwright MCP",
    "risk": "low",
    "source": "project",
    "date_added": "2026-06-20"
  },
  {
    "id": "playwright-explore-website",
    "path": "playwright-explore-website",
    "category": "testing",
    "name": "playwright-explore-website",
    "description": "Website exploration for testing using Playwright MCP",
    "risk": "low",
    "source": "project",
    "date_added": "2026-06-20"
  },
  {
    "id": "playwright-generate-test",
    "path": "playwright-generate-test",
    "category": "frontend",
    "name": "playwright-generate-test",
    "description": "Generate a Playwright test based on a scenario using Playwright MCP",
    "risk": "low",
    "source": "project",
    "date_added": "2026-06-20"
  },
  {
    "id": "postgresql-code-review",